{
  "$schema": "http://json-schema.org/draft-07/schema#",
  "title": "agent_backend skill manifest",
  "type": "object",
  "additionalProperties": false,
  "properties": {
    "skill_id": {
      "type": "string",
      "pattern": "^[a-z][a-z0-9_]*_v[0-9]+$"
    },
    "version": {
      "type": "string",
      "pattern": "^\\d+\\.\\d+\\.\\d+$"
    },
    "name": {
      "type": "string",
      "minLength": 1
    },
    "description": {
      "type": "string",
      "minLength": 20
    },
    "triggers": {
      "type": "array",
      "items": {
        "type": "string"
      },
      "minItems": 1
    },
    "capabilities": {
      "type": "array",
      "items": {
        "type": "string"
      },
      "minItems": 1
    },
    "inputs_schema": {
      "type": "object"
    },
    "outputs_schema": {
      "type": "object"
    },
    "project_scope": {
      "type": "array",
      "items": {
        "type": "string"
      },
      "minItems": 1
    },
    "memory_scope": {
      "type": "string",
      "enum": [
        "none",
        "project",
        "workspace",
        "session"
      ]
    },
    "tool_entrypoints": {
      "type": "array",
      "items": {
        "type": "object",
        "additionalProperties": false,
        "properties": {
          "entrypoint_type": {
            "type": "string",
            "enum": [
              "instruction_only",
              "script",
              "workflow_mode"
            ]
          },
          "target": {
            "type": "string"
          }
        },
        "required": [
          "entrypoint_type",
          "target"
        ]
      },
      "minItems": 1
    },
    "allowed_tools": {
      "type": "array",
      "items": {
        "type": "string"
      }
    },
    "risk_tier": {
      "type": "string",
      "enum": [
        "T1",
        "T2",
        "T3",
        "T4",
        "T5"
      ]
    },
    "approval_requirements": {
      "type": "object",
      "additionalProperties": false,
      "properties": {
        "requires_user_approval": {
          "type": "boolean"
        },
        "requires_diff_approval": {
          "type": "boolean"
        }
      },
      "required": [
        "requires_user_approval",
        "requires_diff_approval"
      ]
    },
    "test_commands": {
      "type": "array",
      "items": {
        "type": "string"
      }
    },
    "rollback_strategy": {
      "type": "string"
    },
    "artifacts_produced": {
      "type": "array",
      "items": {
        "type": "string"
      }
    },
    "examples": {
      "type": "array",
      "items": {
        "type": "object",
        "additionalProperties": false,
        "properties": {
          "input": {
            "type": "object"
          },
          "output": {
            "type": "object"
          }
        },
        "required": [
          "input",
          "output"
        ]
      }
    }
  },
  "required": [
    "skill_id",
    "version",
    "name",
    "description",
    "triggers",
    "capabilities",
    "inputs_schema",
    "outputs_schema",
    "project_scope",
    "memory_scope",
    "tool_entrypoints",
    "allowed_tools",
    "risk_tier",
    "approval_requirements",
    "test_commands",
    "rollback_strategy",
    "artifacts_produced",
    "examples"
  ]
}