{
  "skill_id": "bug_triage_v1",
  "version": "0.1.0",
  "name": "Bug triage",
  "description": "Diagnose a bug or regression by building a feedback loop, reproducing/minimising the issue, ranking root-cause hypotheses, identifying likely files/functions, and handing off a TDD fix plan.",
  "triggers": [
    "triage bug",
    "investigate bug",
    "root cause",
    "failing test",
    "regression",
    "diagnose",
    "reproduction"
  ],
  "capabilities": [
    "bug_triage",
    "candidate_analysis",
    "tdd_planning",
    "root_cause_analysis"
  ],
  "inputs_schema": {
    "type": "object",
    "additionalProperties": false,
    "properties": {
      "objective": {
        "type": "string"
      },
      "target_repo": {
        "type": "string"
      },
      "logs": {
        "type": "string"
      },
      "failing_test_output": {
        "type": "string"
      },
      "observed_behavior": {
        "type": "string"
      },
      "expected_behavior": {
        "type": "string"
      }
    },
    "required": [
      "objective",
      "target_repo"
    ]
  },
  "outputs_schema": {
    "type": "object",
    "additionalProperties": false,
    "properties": {
      "summary": {
        "type": "string"
      },
      "feedback_loop": {
        "type": "string"
      },
      "reproduction_status": {
        "type": "string",
        "enum": [
          "reproduced",
          "not_reproduced",
          "partially_reproduced",
          "unknown"
        ]
      },
      "minimized_case": {
        "type": "string"
      },
      "ranked_hypotheses": {
        "type": "array",
        "items": {
          "type": "object",
          "additionalProperties": true
        }
      },
      "likely_candidates": {
        "type": "array",
        "items": {
          "type": "object",
          "additionalProperties": true
        }
      },
      "instrumentation_plan": {
        "type": "array",
        "items": {
          "type": "object",
          "additionalProperties": true
        }
      },
      "regression_test_seam": {
        "type": "string"
      },
      "tdd_handoff": {
        "type": "object",
        "additionalProperties": true
      },
      "next_action": {
        "type": "string"
      }
    },
    "required": [
      "summary",
      "likely_candidates",
      "next_action"
    ]
  },
  "project_scope": [
    "*"
  ],
  "memory_scope": "project",
  "tool_entrypoints": [
    {
      "entrypoint_type": "instruction_only",
      "target": "SKILL.md"
    }
  ],
  "allowed_tools": [
    "mcp_get_active_partition",
    "mcp_semantic_search_active",
    "mcp_scout_workspace"
  ],
  "risk_tier": "T1",
  "approval_requirements": {
    "requires_user_approval": false,
    "requires_diff_approval": false
  },
  "test_commands": [],
  "rollback_strategy": "none",
  "artifacts_produced": [
    "triage_report",
    "candidate_list",
    "tdd_plan"
  ],
  "examples": [
    {
      "input": {
        "objective": "Investigate why semantic search returns stale chunks after a file edit.",
        "target_repo": "agent_backend",
        "logs": "search returns old content after reindex",
        "failing_test_output": ""
      },
      "output": {
        "summary": "Search appears to return stale vectors after reindex.",
        "feedback_loop": "Add or run an ingestion/search regression around edit -> ingest -> search.",
        "reproduction_status": "unknown",
        "minimized_case": "Single fixture file edited from phrase A to phrase B, then reindexed and searched for A/B.",
        "ranked_hypotheses": [
          {
            "rank": 1,
            "hypothesis": "stale Chroma vector records are not removed before upsert",
            "evidence": "symptom mentions old content after reindex"
          }
        ],
        "likely_candidates": [
          {
            "rank": 1,
            "path": "orchestrator/ingest/service.py",
            "reason": "likely owns reindex/delete lifecycle"
          }
        ],
        "instrumentation_plan": [
          {
            "step": "Log chunk ids deleted and upserted during force_reindex"
          }
        ],
        "regression_test_seam": "Ingestion service fixture test with changed file content.",
        "tdd_handoff": {
          "skill": "tdd_patch_plan_v1"
        },
        "next_action": "Create a RED test around stale search results after reindex."
      }
    }
  ]
}